{
  "version": "1.0",
  "interval_hours": 2,
  "selectors": {
    "css": {
      "purchase_card": ".search-results__item",
      "purchase_id": ".registry-entry__header-top__number a",
      "purchase_name": ".registry-entry__body-title",
      "purchase_price": ".registry-entry__price .price",
      "publisher_inn": ".registry-entry__customer-info .inn",
      "purchase_link": ".registry-entry__header-top__number a",
      "purchase_date": ".registry-entry__header-top__date"
    },
    "xpath": {}
  },
  "emails": [
    "zakupki@company.ru",
    "director@company.ru",
    "backup@company.ru"
  ],
  "inn_list": [
    "7728168971",
    "7736050003",
    "5024002116"
  ],
  "history": [
    "0373100124520000016",
    "0373100124520000023"
  ],
  "smtp": {
    "host": "smtp.yandex.ru",
    "port": 465,
    "from_email": "monitor@zakupki-monitor.ru",
    "from_name": "Zakupki Monitor",
    "use_ssl": true,
    "login": "monitor@zakupki-monitor.ru",
    "password": "your-app-password"
  }
}